{
  "schema": "assetsstudio_garment_recipe_v1",
  "recipe_id": "mage_robe_body_v1_seed01",
  "asset_type": "humanoid.garment",
  "archetype": "mage_robe_body_v1",
  "seed": 1,
  "parameters": {
    "length_factor": 0.90,
    "skirt_length_factor": 0.72,
    "body_width_factor": 1.05,
    "hem_flare": 1.00,
    "sleeve_length_factor": 1.5,
    "cuff_width_factor": 1.10
  },
  "materials": {
    "main_color": "#202A68",
    "trim_color": "#D7A63A"
  }
}
